<?xml version="1.0" encoding="UTF-8" standalone="yes" ?>
<appliances
        xmlns="http://www.site.com"
        xmlns:xsi="http://www.w3.org/2001/XMLSchema-instance"
            xsi:noNamespaceSchemaLocation="appliances.xsd">
    <kettle>
        <energy_Efficiency_Class>B</energy_Efficiency_Class>
        <manufacturer>Bosh</manufacturer>
        <model>Crater</model>
        <power>250</power>
        <switched>true</switched>
        <volume>2</volume>
    </kettle>
    <termopot>
        <energy_Efficiency_Class>A</energy_Efficiency_Class>
        <manufacturer>Bosh</manufacturer>
        <model>Crater</model>
        <power>250</power>
        <switched>true</switched>
        <volume>2</volume>
        <max_Holding_Temperature>100</max_Holding_Temperature>
    </termopot>
    <conditioner>
        <energy_Efficiency_Class>C</energy_Efficiency_Class>
        <manufacturer>LG</manufacturer>
        <model>ZX-330</model>
        <power>200</power>
        <switched>true</switched>
        <service_Area>200</service_Area>
        <type>external</type>
        <heating>true</heating>
    </conditioner>
    <kettle>
        <energy_Efficiency_Class>A</energy_Efficiency_Class>
        <manufacturer>Vitec</manufacturer>
        <model>PWF</model>
        <power>200</power>
        <switched>true</switched>
        <volume>1</volume>
    </kettle>
    <microwave>
        <energy_Efficiency_Class>A</energy_Efficiency_Class>
        <manufacturer>Samsung</manufacturer>
        <model>FIFO</model>
        <power>300</power>
        <switched>true</switched>
        <volume_Of_Furnace>111</volume_Of_Furnace>
        <mods>2</mods>
        <have_Grill>true</have_Grill>
        <power_Waves>2000</power_Waves>
    </microwave>
    <dishwasher>
        <energy_Efficiency_Class>A</energy_Efficiency_Class>
        <manufacturer>DISH</manufacturer>
        <model>WASHER</model>
        <power>100</power>
        <switched>true</switched>
        <water_Consumption>100</water_Consumption>
        <washing_Class>E</washing_Class>
        <number_Of_Programs>2</number_Of_Programs>
        <max_Load_Of_Dishes>10</max_Load_Of_Dishes>
        <type_Of_Drying>FF</type_Of_Drying>
    </dishwasher>

</appliances>